Товар;"ID варианта";Вариант;Цена;"ID валюты";"Старая цена";"Заголовок страницы";"Ключевые слова";"Описание страницы";Аннотация;Описание;Age;Material;Camera
"Ironing board Gimi Temper Drop";22;;65.00;2;;"Ironing board Gimi Temper Drop";"Ironing board Gimi Temper Drop, С переводом";"Ironing board has a special base-place for the iron. Painted steel tube (diameter 22 and 32 mm) oval in cross-section, which gives additional stability.";"<p>Ironing board has a special base-place for the iron. Painted steel tube (diameter 22 and 32 mm) oval in cross-section, which gives additional stability.</p>";"<p>Ironing board has a special base-place for the iron. Painted steel tube (diameter 22 and 32 mm) oval in cross-section, which gives additional stability.</p>
<p>&nbsp;<span style=""font-size: 13px;"">Holder for electric cable from the iron. 100% cotton board cover, lined with soft fleece. The surface of the ironing board is formed as a mesh, allowing free flowing of the iron&rsquo;s steam. Form table beveled for easy smoothing underwear in tight spaces. Ironing board easily folded, takes up little space when folded. Large working surface of the ironing board allows not only to iron shirts, men's trousers, but also bedding. The height of the ironing board can be freely adjusted. Solid and durable.</span></p>";"From birth";;
"Electric fireplace Dimplex Mozart";21;;700.00;2;;"Electric fireplace Dimplex Mozart";"Electric fireplace Dimplex Mozart, С переводом";"Electric fireplace with portals assembly flame effect Optiflame. Adjustable heat output of 1-2 kW. Ability to work without heating. Portal's color - white.";"<p><span>Electric fireplace with portals assembly flame effect Optiflame. Adjustable heat output of 1-2 kW. Ability to work without heating. Portal's color - white.</span></p>";"<p>Electric fireplace with portals assembly flame effect Optiflame. Adjustable heat output of 1-2 kW. Ability to work without heating. Portal's color - white.</p>";;;
"Motorola MBP 35 Remote Wireless Video Baby Monitor";20;;198.00;2;;"Motorola MBP 35 Remote Wireless Video Baby Monitor";"Motorola MBP 35 Remote Wireless Video Baby Monitor, С переводом";"Digital video baby monitor with a large 3.5 inch LCD display. Night Vision mode. Sleep mode for battery saving.";"<p>Digital video baby monitor with a large 3.5 inch LCD display. Night Vision mode. Sleep mode for battery saving.</p>";"<p><span>Digital video baby monitor with a large 3.5 inch LCD display. Night Vision mode. Sleep mode for battery saving.&nbsp;</span>A large reception area with a warning. It allows you to look after your baby at a distance of 150 meters. Clear sound with the volume indicator. Digital thermometer. Highly sensitive microphone. Communication in both directions. Five lullabies. Rechargeable battery.</p>";;;
"Stroller LONEX Classic Retro";19;;432.00;2;;"Stroller LONEX Classic Retro";"Stroller LONEX Classic Retro, С переводом";"Universal stroller made of natural vine for babies under 6 month.";"<p><span style=""font-size: 13px;"">Universal stroller made of natural vine for babies under 6 month.</span></p>";"<p><span>Universal stroller made of natural vine for babies under 6 month.&nbsp;</span><span style=""font-size: 13px;"">The stroller has a removable bassinet and the stroller seat. Depreciation on 4 wheels. Wheels option: diameter 40 cm - not inflatable, diameter 36 cm - inflatable. Chrome disks. The seat unit can be installed in two directions. The backrest is adjustable in 4 positions to horizontal. There are five-point safety harness with soft lining and restrictive bumper. Adjustable footrest. The kit includes an insulated cover on foot, shopping basket, bag for mom, raincoat. Great range of colors.</span></p>";;;
"Gorenje BO87KR oven";18;;1300.00;2;;"Gorenje BO87KR oven";"Gorenje BO87KR oven, С переводом";"Built oven width 60 cm and a volume of 64 liters. Electronic sensor module with a temperature probe. MoodLite led lighting with 7 colors.";"<p>Built oven width 60 cm and a volume of 64 liters. Electronic sensor module with a temperature probe. MoodLite led lighting with 7 colors.</p>";"<p><span>Built oven width 60 cm and a volume of 64 liters. Electronic sensor module with a temperature probe. MoodLite led lighting with 7 colors.</span>&nbsp;<span style=""font-size: 13px;"">Timer. Alarm clock. 8 programmes set by the manufacturer by product type. The ability to create three own programs. Beep. Continuous glazing of the oven door. Flip top heaters. Child lock. Temperature sensor. Safety shutdown.</span></p>";;;
